{"$schema":"https://json-schema.org/draft/2020-12/schema","title":"AppDefinition version 1","$ref":"#/$defs/AppDefinition","$defs":{"AppDefinition":{"type":"object","properties":{"version":{"const":1},"id":{"type":"string","minLength":1,"maxLength":128,"pattern":"^[a-z0-9_-]+$"},"label":{"type":"string","maxLength":4096},"entities":{"type":"array","items":{"$ref":"#/$defs/EntityDefinition"},"maxItems":256},"state":{"type":"array","items":{"$ref":"#/$defs/StateDefinition"},"maxItems":256},"actions":{"type":"array","items":{"$ref":"#/$defs/ActionDefinition"},"maxItems":256},"outputs":{"type":"array","items":{"$ref":"#/$defs/OutputDefinition"},"maxItems":256},"observables":{"type":"array","items":{"$ref":"#/$defs/ObservableDefinition"},"maxItems":256},"views":{"type":"array","items":{"$ref":"#/$defs/ViewDefinition"},"maxItems":256},"initial_view":{"type":"string","minLength":1,"maxLength":128,"pattern":"^[a-z0-9_-]+$"}},"required":["version","id","label","entities","state","actions","outputs","observables","views","initial_view"],"additionalProperties":false},"ViewDefinition":{"type":"object","properties":{"id":{"type":"string","minLength":1,"maxLength":128,"pattern":"^[a-z0-9_-]+$"},"label":{"type":"string","maxLength":4096},"kind":{"$ref":"#/$defs/ViewKind"},"actions":{"type":"array","items":{"$ref":"#/$defs/ActionBinding"},"maxItems":256},"keys":{"type":"array","items":{"$ref":"#/$defs/KeyBinding"},"maxItems":256}},"required":["id","label","kind","actions","keys"],"additionalProperties":false},"KeyBinding":{"type":"object","properties":{"key":{"type":"string","maxLength":4096},"modifiers":{"type":"array","items":{"$ref":"#/$defs/KeyModifier"},"maxItems":256,"uniqueItems":true},"binding":{"type":"string","minLength":1,"maxLength":128,"pattern":"^[a-z0-9_-]+$"}},"required":["key","modifiers","binding"],"additionalProperties":false},"KeyModifier":{"type":"string","enum":["control","alt","shift","command"]},"ActionBinding":{"type":"object","properties":{"id":{"type":"string","minLength":1,"maxLength":128,"pattern":"^[a-z0-9_-]+$"},"label":{"type":"string","maxLength":4096},"placement":{"$ref":"#/$defs/ActionPlacement"},"action":{"type":"string","minLength":1,"maxLength":128,"pattern":"^[a-z0-9_-]+$"},"arguments":{"type":"object","propertyNames":{"type":"string","minLength":1,"maxLength":128,"pattern":"^[a-z0-9_-]+$"},"maxProperties":256,"additionalProperties":{"$ref":"#/$defs/Expr"}},"enabled":{"$ref":"#/$defs/Expr"}},"required":["id","label","placement","action","arguments","enabled"],"additionalProperties":false},"Expr":{"oneOf":[{"type":"object","properties":{"kind":{"const":"literal"},"value_type":{"$ref":"#/$defs/Type"},"value":{"$ref":"#/$defs/DataValue"}},"required":["kind","value_type","value"],"additionalProperties":false},{"type":"object","properties":{"kind":{"const":"variable"},"name":{"type":"string","minLength":1,"maxLength":128,"pattern":"^[a-z0-9_-]+$"}},"required":["kind","name"],"additionalProperties":false},{"type":"object","properties":{"kind":{"const":"field"},"record":{"$ref":"#/$defs/Expr"},"field":{"type":"string","minLength":1,"maxLength":128,"pattern":"^[a-z0-9_-]+$"}},"required":["kind","record","field"],"additionalProperties":false},{"type":"object","properties":{"kind":{"const":"state"},"state":{"type":"string","minLength":1,"maxLength":128,"pattern":"^[a-z0-9_-]+$"}},"required":["kind","state"],"additionalProperties":false},{"type":"object","properties":{"kind":{"const":"today"}},"required":["kind"],"additionalProperties":false},{"type":"object","properties":{"kind":{"const":"query"},"entity":{"type":"string","minLength":1,"maxLength":128,"pattern":"^[a-z0-9_-]+$"},"binding":{"type":"string","minLength":1,"maxLength":128,"pattern":"^[a-z0-9_-]+$"},"predicate":{"$ref":"#/$defs/Expr"},"sort":{"type":"array","items":{"$ref":"#/$defs/SortKey"},"maxItems":256},"limit":{"type":"integer","minimum":1,"maximum":10000},"include_archived":{"type":"boolean"}},"required":["kind","entity","binding","predicate","sort","limit","include_archived"],"additionalProperties":false},{"type":"object","properties":{"kind":{"const":"filter"},"items":{"$ref":"#/$defs/Expr"},"binding":{"type":"string","minLength":1,"maxLength":128,"pattern":"^[a-z0-9_-]+$"},"predicate":{"$ref":"#/$defs/Expr"}},"required":["kind","items","binding","predicate"],"additionalProperties":false},{"type":"object","properties":{"kind":{"const":"map"},"items":{"$ref":"#/$defs/Expr"},"binding":{"type":"string","minLength":1,"maxLength":128,"pattern":"^[a-z0-9_-]+$"},"value":{"$ref":"#/$defs/Expr"}},"required":["kind","items","binding","value"],"additionalProperties":false},{"type":"object","properties":{"kind":{"const":"count"},"items":{"$ref":"#/$defs/Expr"}},"required":["kind","items"],"additionalProperties":false},{"type":"object","properties":{"kind":{"const":"any"},"items":{"$ref":"#/$defs/Expr"},"binding":{"type":"string","minLength":1,"maxLength":128,"pattern":"^[a-z0-9_-]+$"},"predicate":{"$ref":"#/$defs/Expr"}},"required":["kind","items","binding","predicate"],"additionalProperties":false},{"type":"object","properties":{"kind":{"const":"all"},"items":{"$ref":"#/$defs/Expr"},"binding":{"type":"string","minLength":1,"maxLength":128,"pattern":"^[a-z0-9_-]+$"},"predicate":{"$ref":"#/$defs/Expr"}},"required":["kind","items","binding","predicate"],"additionalProperties":false},{"type":"object","properties":{"kind":{"const":"sum"},"items":{"$ref":"#/$defs/Expr"}},"required":["kind","items"],"additionalProperties":false},{"type":"object","properties":{"kind":{"const":"contains"},"items":{"$ref":"#/$defs/Expr"},"value":{"$ref":"#/$defs/Expr"}},"required":["kind","items","value"],"additionalProperties":false},{"type":"object","properties":{"kind":{"const":"equal"},"left":{"$ref":"#/$defs/Expr"},"right":{"$ref":"#/$defs/Expr"}},"required":["kind","left","right"],"additionalProperties":false},{"type":"object","properties":{"kind":{"const":"less"},"left":{"$ref":"#/$defs/Expr"},"right":{"$ref":"#/$defs/Expr"}},"required":["kind","left","right"],"additionalProperties":false},{"type":"object","properties":{"kind":{"const":"add"},"left":{"$ref":"#/$defs/Expr"},"right":{"$ref":"#/$defs/Expr"}},"required":["kind","left","right"],"additionalProperties":false},{"type":"object","properties":{"kind":{"const":"subtract"},"left":{"$ref":"#/$defs/Expr"},"right":{"$ref":"#/$defs/Expr"}},"required":["kind","left","right"],"additionalProperties":false},{"type":"object","properties":{"kind":{"const":"concat"},"left":{"$ref":"#/$defs/Expr"},"right":{"$ref":"#/$defs/Expr"}},"required":["kind","left","right"],"additionalProperties":false},{"type":"object","properties":{"kind":{"const":"text_contains"},"text":{"$ref":"#/$defs/Expr"},"search":{"$ref":"#/$defs/Expr"}},"required":["kind","text","search"],"additionalProperties":false},{"type":"object","properties":{"kind":{"const":"lower"},"value":{"$ref":"#/$defs/Expr"}},"required":["kind","value"],"additionalProperties":false},{"type":"object","properties":{"kind":{"const":"and"},"values":{"type":"array","items":{"$ref":"#/$defs/Expr"},"maxItems":256}},"required":["kind","values"],"additionalProperties":false},{"type":"object","properties":{"kind":{"const":"or"},"values":{"type":"array","items":{"$ref":"#/$defs/Expr"},"maxItems":256}},"required":["kind","values"],"additionalProperties":false},{"type":"object","properties":{"kind":{"const":"not"},"value":{"$ref":"#/$defs/Expr"}},"required":["kind","value"],"additionalProperties":false},{"type":"object","properties":{"kind":{"const":"if"},"condition":{"$ref":"#/$defs/Expr"},"then_value":{"$ref":"#/$defs/Expr"},"else_value":{"$ref":"#/$defs/Expr"}},"required":["kind","condition","then_value","else_value"],"additionalProperties":false},{"type":"object","properties":{"kind":{"const":"coalesce"},"value":{"$ref":"#/$defs/Expr"},"fallback":{"$ref":"#/$defs/Expr"}},"required":["kind","value","fallback"],"additionalProperties":false},{"type":"object","properties":{"kind":{"const":"date_add"},"date":{"$ref":"#/$defs/Expr"},"days":{"$ref":"#/$defs/Expr"}},"required":["kind","date","days"],"additionalProperties":false},{"type":"object","properties":{"kind":{"const":"date_difference"},"later":{"$ref":"#/$defs/Expr"},"earlier":{"$ref":"#/$defs/Expr"}},"required":["kind","later","earlier"],"additionalProperties":false}]},"SortKey":{"type":"object","properties":{"value":{"$ref":"#/$defs/Expr"},"descending":{"type":"boolean"}},"required":["value","descending"],"additionalProperties":false},"DataValue":{"oneOf":[{"type":"object","properties":{"kind":{"const":"null"}},"required":["kind"],"additionalProperties":false},{"type":"object","properties":{"kind":{"const":"boolean"},"value":{"type":"boolean"}},"required":["kind","value"],"additionalProperties":false},{"type":"object","properties":{"kind":{"const":"integer"},"value":{"type":"integer","minimum":-9223372036854775808,"maximum":9223372036854775807}},"required":["kind","value"],"additionalProperties":false},{"type":"object","properties":{"kind":{"const":"text"},"value":{"type":"string","maxLength":4096}},"required":["kind","value"],"additionalProperties":false},{"type":"object","properties":{"kind":{"const":"date"},"days":{"type":"integer","minimum":-2147483648,"maximum":2147483647}},"required":["kind","days"],"additionalProperties":false},{"type":"object","properties":{"kind":{"const":"reference"},"entity":{"type":"string","minLength":1,"maxLength":128,"pattern":"^[a-z0-9_-]+$"},"record":{"type":"string","minLength":1,"maxLength":128,"pattern":"^[a-z0-9_-]+$"}},"required":["kind","entity","record"],"additionalProperties":false},{"type":"object","properties":{"kind":{"const":"list"},"item_type":{"$ref":"#/$defs/Type"},"items":{"type":"array","items":{"$ref":"#/$defs/DataValue"},"maxItems":10000}},"required":["kind","item_type","items"],"additionalProperties":false}]},"Type":{"oneOf":[{"type":"object","properties":{"kind":{"const":"boolean"}},"required":["kind"],"additionalProperties":false},{"type":"object","properties":{"kind":{"const":"integer"}},"required":["kind"],"additionalProperties":false},{"type":"object","properties":{"kind":{"const":"text"}},"required":["kind"],"additionalProperties":false},{"type":"object","properties":{"kind":{"const":"date"}},"required":["kind"],"additionalProperties":false},{"type":"object","properties":{"kind":{"const":"reference"},"entity":{"type":"string","minLength":1,"maxLength":128,"pattern":"^[a-z0-9_-]+$"}},"required":["kind","entity"],"additionalProperties":false},{"type":"object","properties":{"kind":{"const":"list"},"item":{"$ref":"#/$defs/Type"}},"required":["kind","item"],"additionalProperties":false},{"type":"object","properties":{"kind":{"const":"optional"},"item":{"$ref":"#/$defs/Type"}},"required":["kind","item"],"additionalProperties":false}]},"ActionPlacement":{"type":"string","enum":["toolbar","row"]},"ViewKind":{"oneOf":[{"type":"object","properties":{"kind":{"const":"list"},"entity":{"type":"string","minLength":1,"maxLength":128,"pattern":"^[a-z0-9_-]+$"},"rows":{"$ref":"#/$defs/Expr"},"columns":{"type":"array","items":{"$ref":"#/$defs/Column"},"maxItems":256},"controls":{"type":"array","items":{"$ref":"#/$defs/StateControl"},"maxItems":256},"selection":{"anyOf":[{"$ref":"#/$defs/SelectionBinding"},{"type":"null"}]}},"required":["kind","entity","rows","columns","controls","selection"],"additionalProperties":false},{"type":"object","properties":{"kind":{"const":"detail"},"entity":{"type":"string","minLength":1,"maxLength":128,"pattern":"^[a-z0-9_-]+$"},"record":{"$ref":"#/$defs/Expr"},"columns":{"type":"array","items":{"$ref":"#/$defs/Column"},"maxItems":256}},"required":["kind","entity","record","columns"],"additionalProperties":false},{"type":"object","properties":{"kind":{"const":"form"},"action":{"type":"string","minLength":1,"maxLength":128,"pattern":"^[a-z0-9_-]+$"},"fields":{"type":"array","items":{"$ref":"#/$defs/FormInput"},"maxItems":256},"defaults":{"type":"object","propertyNames":{"type":"string","minLength":1,"maxLength":128,"pattern":"^[a-z0-9_-]+$"},"maxProperties":256,"additionalProperties":{"$ref":"#/$defs/DataValue"}}},"required":["kind","action","fields","defaults"],"additionalProperties":false}]},"FormInput":{"type":"object","properties":{"parameter":{"type":"string","minLength":1,"maxLength":128,"pattern":"^[a-z0-9_-]+$"},"label":{"type":"string","maxLength":4096}},"required":["parameter","label"],"additionalProperties":false},"Column":{"type":"object","properties":{"id":{"type":"string","minLength":1,"maxLength":128,"pattern":"^[a-z0-9_-]+$"},"label":{"type":"string","maxLength":4096},"value":{"$ref":"#/$defs/Expr"}},"required":["id","label","value"],"additionalProperties":false},"SelectionBinding":{"type":"object","properties":{"id":{"type":"string","minLength":1,"maxLength":128,"pattern":"^[a-z0-9_-]+$"},"state":{"type":"string","minLength":1,"maxLength":128,"pattern":"^[a-z0-9_-]+$"},"on_change":{"anyOf":[{"type":"string","minLength":1,"maxLength":128,"pattern":"^[a-z0-9_-]+$"},{"type":"null"}]}},"required":["id","state","on_change"],"additionalProperties":false},"StateControl":{"type":"object","properties":{"id":{"type":"string","minLength":1,"maxLength":128,"pattern":"^[a-z0-9_-]+$"},"label":{"type":"string","maxLength":4096},"state":{"type":"string","minLength":1,"maxLength":128,"pattern":"^[a-z0-9_-]+$"},"on_change":{"anyOf":[{"type":"string","minLength":1,"maxLength":128,"pattern":"^[a-z0-9_-]+$"},{"type":"null"}]}},"required":["id","label","state","on_change"],"additionalProperties":false},"ObservableDefinition":{"type":"object","properties":{"id":{"type":"string","minLength":1,"maxLength":128,"pattern":"^[a-z0-9_-]+$"},"label":{"type":"string","maxLength":4096},"value":{"$ref":"#/$defs/Expr"}},"required":["id","label","value"],"additionalProperties":false},"OutputDefinition":{"type":"object","properties":{"id":{"type":"string","minLength":1,"maxLength":128,"pattern":"^[a-z0-9_-]+$"},"label":{"type":"string","maxLength":4096},"format":{"$ref":"#/$defs/OutputFormat"},"columns":{"type":"array","items":{"$ref":"#/$defs/FieldDefinition"},"maxItems":256}},"required":["id","label","format","columns"],"additionalProperties":false},"FieldDefinition":{"type":"object","properties":{"id":{"type":"string","minLength":1,"maxLength":128,"pattern":"^[a-z0-9_-]+$"},"label":{"type":"string","maxLength":4096},"value_type":{"$ref":"#/$defs/Type"}},"required":["id","label","value_type"],"additionalProperties":false},"OutputFormat":{"type":"string","enum":["csv","json"]},"ActionDefinition":{"type":"object","properties":{"id":{"type":"string","minLength":1,"maxLength":128,"pattern":"^[a-z0-9_-]+$"},"label":{"type":"string","maxLength":4096},"parameters":{"type":"object","propertyNames":{"type":"string","minLength":1,"maxLength":128,"pattern":"^[a-z0-9_-]+$"},"maxProperties":256,"additionalProperties":{"$ref":"#/$defs/Type"}},"guards":{"type":"array","items":{"$ref":"#/$defs/Expr"},"maxItems":256},"steps":{"type":"array","items":{"$ref":"#/$defs/Statement"},"maxItems":256},"ensures":{"type":"array","items":{"$ref":"#/$defs/Expr"},"maxItems":256}},"required":["id","label","parameters","guards","steps","ensures"],"additionalProperties":false},"Statement":{"oneOf":[{"type":"object","properties":{"kind":{"const":"create"},"entity":{"type":"string","minLength":1,"maxLength":128,"pattern":"^[a-z0-9_-]+$"},"values":{"type":"object","propertyNames":{"type":"string","minLength":1,"maxLength":128,"pattern":"^[a-z0-9_-]+$"},"maxProperties":256,"additionalProperties":{"$ref":"#/$defs/Expr"}},"bind":{"type":"string","minLength":1,"maxLength":128,"pattern":"^[a-z0-9_-]+$"}},"required":["kind","entity","values","bind"],"additionalProperties":false},{"type":"object","properties":{"kind":{"const":"update"},"record":{"$ref":"#/$defs/Expr"},"values":{"type":"object","propertyNames":{"type":"string","minLength":1,"maxLength":128,"pattern":"^[a-z0-9_-]+$"},"maxProperties":256,"additionalProperties":{"$ref":"#/$defs/Expr"}}},"required":["kind","record","values"],"additionalProperties":false},{"type":"object","properties":{"kind":{"const":"archive"},"record":{"$ref":"#/$defs/Expr"}},"required":["kind","record"],"additionalProperties":false},{"type":"object","properties":{"kind":{"const":"set_state"},"state":{"type":"string","minLength":1,"maxLength":128,"pattern":"^[a-z0-9_-]+$"},"value":{"$ref":"#/$defs/Expr"}},"required":["kind","state","value"],"additionalProperties":false},{"type":"object","properties":{"kind":{"const":"collection"},"target":{"$ref":"#/$defs/CollectionTarget"},"operation":{"$ref":"#/$defs/CollectionOperation"},"items":{"$ref":"#/$defs/Expr"}},"required":["kind","target","operation","items"],"additionalProperties":false},{"type":"object","properties":{"kind":{"const":"for_each"},"items":{"$ref":"#/$defs/Expr"},"binding":{"type":"string","minLength":1,"maxLength":128,"pattern":"^[a-z0-9_-]+$"},"steps":{"type":"array","items":{"$ref":"#/$defs/Statement"},"maxItems":256}},"required":["kind","items","binding","steps"],"additionalProperties":false},{"type":"object","properties":{"kind":{"const":"assert"},"condition":{"$ref":"#/$defs/Expr"},"message":{"type":"string","maxLength":4096}},"required":["kind","condition","message"],"additionalProperties":false},{"type":"object","properties":{"kind":{"const":"emit"},"output":{"type":"string","minLength":1,"maxLength":128,"pattern":"^[a-z0-9_-]+$"},"items":{"$ref":"#/$defs/Expr"},"binding":{"type":"string","minLength":1,"maxLength":128,"pattern":"^[a-z0-9_-]+$"},"columns":{"type":"object","propertyNames":{"type":"string","minLength":1,"maxLength":128,"pattern":"^[a-z0-9_-]+$"},"maxProperties":256,"additionalProperties":{"$ref":"#/$defs/Expr"}}},"required":["kind","output","items","binding","columns"],"additionalProperties":false}]},"CollectionOperation":{"type":"string","enum":["insert","remove"]},"CollectionTarget":{"oneOf":[{"type":"object","properties":{"kind":{"const":"state"},"state":{"type":"string","minLength":1,"maxLength":128,"pattern":"^[a-z0-9_-]+$"}},"required":["kind","state"],"additionalProperties":false},{"type":"object","properties":{"kind":{"const":"field"},"record":{"$ref":"#/$defs/Expr"},"field":{"type":"string","minLength":1,"maxLength":128,"pattern":"^[a-z0-9_-]+$"}},"required":["kind","record","field"],"additionalProperties":false}]},"StateDefinition":{"type":"object","properties":{"id":{"type":"string","minLength":1,"maxLength":128,"pattern":"^[a-z0-9_-]+$"},"label":{"type":"string","maxLength":4096},"value_type":{"$ref":"#/$defs/Type"},"initial":{"$ref":"#/$defs/DataValue"}},"required":["id","label","value_type","initial"],"additionalProperties":false},"EntityDefinition":{"type":"object","properties":{"id":{"type":"string","minLength":1,"maxLength":128,"pattern":"^[a-z0-9_-]+$"},"label":{"type":"string","maxLength":4096},"fields":{"type":"array","items":{"$ref":"#/$defs/FieldDefinition"},"maxItems":256},"unique":{"type":"array","items":{"type":"array","items":{"type":"string","minLength":1,"maxLength":128,"pattern":"^[a-z0-9_-]+$"},"maxItems":256},"maxItems":256},"constraints":{"type":"array","items":{"$ref":"#/$defs/Expr"},"maxItems":256}},"required":["id","label","fields","unique","constraints"],"additionalProperties":false}}}
