{
  "actions": [
    {
      "ensures": [],
      "guards": [],
      "id": "add",
      "label": "add",
      "parameters": {
        "title": {
          "kind": "text"
        }
      },
      "steps": [
        {
          "bind": "made",
          "entity": "job",
          "kind": "create",
          "values": {
            "status": {
              "kind": "literal",
              "value": {
                "kind": "text",
                "value": "ready"
              },
              "value_type": {
                "kind": "text"
              }
            },
            "title": {
              "kind": "variable",
              "name": "title"
            }
          }
        }
      ]
    },
    {
      "ensures": [],
      "guards": [
        {
          "kind": "equal",
          "left": {
            "field": "status",
            "kind": "field",
            "record": {
              "kind": "variable",
              "name": "job"
            }
          },
          "right": {
            "kind": "literal",
            "value": {
              "kind": "text",
              "value": "ready"
            },
            "value_type": {
              "kind": "text"
            }
          }
        }
      ],
      "id": "complete",
      "label": "complete",
      "parameters": {
        "job": {
          "entity": "job",
          "kind": "reference"
        }
      },
      "steps": [
        {
          "kind": "update",
          "record": {
            "kind": "variable",
            "name": "job"
          },
          "values": {
            "status": {
              "kind": "literal",
              "value": {
                "kind": "text",
                "value": "done"
              },
              "value_type": {
                "kind": "text"
              }
            }
          }
        }
      ]
    },
    {
      "ensures": [],
      "guards": [
        {
          "kind": "not",
          "value": {
            "kind": "equal",
            "left": {
              "field": "status",
              "kind": "field",
              "record": {
                "kind": "variable",
                "name": "owner"
              }
            },
            "right": {
              "kind": "literal",
              "value": {
                "kind": "text",
                "value": "done"
              },
              "value_type": {
                "kind": "text"
              }
            }
          }
        }
      ],
      "id": "register",
      "label": "register",
      "parameters": {
        "name": {
          "kind": "text"
        },
        "owner": {
          "entity": "job",
          "kind": "reference"
        }
      },
      "steps": [
        {
          "binding": "gate",
          "items": {
            "binding": "j",
            "entity": "job",
            "include_archived": false,
            "kind": "query",
            "limit": 10000,
            "predicate": {
              "kind": "and",
              "values": [
                {
                  "kind": "equal",
                  "left": {
                    "kind": "variable",
                    "name": "j"
                  },
                  "right": {
                    "kind": "variable",
                    "name": "owner"
                  }
                },
                {
                  "kind": "equal",
                  "left": {
                    "items": {
                      "binding": "m",
                      "entity": "material",
                      "include_archived": false,
                      "kind": "query",
                      "limit": 10000,
                      "predicate": {
                        "kind": "equal",
                        "left": {
                          "field": "name",
                          "kind": "field",
                          "record": {
                            "kind": "variable",
                            "name": "m"
                          }
                        },
                        "right": {
                          "kind": "variable",
                          "name": "name"
                        }
                      },
                      "sort": []
                    },
                    "kind": "count"
                  },
                  "right": {
                    "kind": "literal",
                    "value": {
                      "kind": "integer",
                      "value": 0
                    },
                    "value_type": {
                      "kind": "integer"
                    }
                  }
                }
              ]
            },
            "sort": []
          },
          "kind": "for_each",
          "steps": [
            {
              "bind": "made",
              "entity": "material",
              "kind": "create",
              "values": {
                "name": {
                  "kind": "variable",
                  "name": "name"
                },
                "received": {
                  "kind": "literal",
                  "value": {
                    "kind": "boolean",
                    "value": false
                  },
                  "value_type": {
                    "kind": "boolean"
                  }
                }
              }
            }
          ]
        },
        {
          "binding": "material",
          "items": {
            "binding": "m",
            "entity": "material",
            "include_archived": false,
            "kind": "query",
            "limit": 10000,
            "predicate": {
              "kind": "equal",
              "left": {
                "field": "name",
                "kind": "field",
                "record": {
                  "kind": "variable",
                  "name": "m"
                }
              },
              "right": {
                "kind": "variable",
                "name": "name"
              }
            },
            "sort": []
          },
          "kind": "for_each",
          "steps": [
            {
              "binding": "link_gate",
              "items": {
                "binding": "j",
                "entity": "job",
                "include_archived": false,
                "kind": "query",
                "limit": 10000,
                "predicate": {
                  "kind": "and",
                  "values": [
                    {
                      "kind": "equal",
                      "left": {
                        "kind": "variable",
                        "name": "j"
                      },
                      "right": {
                        "kind": "variable",
                        "name": "owner"
                      }
                    },
                    {
                      "kind": "equal",
                      "left": {
                        "items": {
                          "binding": "r",
                          "entity": "requirement",
                          "include_archived": false,
                          "kind": "query",
                          "limit": 10000,
                          "predicate": {
                            "kind": "and",
                            "values": [
                              {
                                "kind": "equal",
                                "left": {
                                  "field": "job",
                                  "kind": "field",
                                  "record": {
                                    "kind": "variable",
                                    "name": "r"
                                  }
                                },
                                "right": {
                                  "kind": "variable",
                                  "name": "owner"
                                }
                              },
                              {
                                "kind": "equal",
                                "left": {
                                  "field": "material",
                                  "kind": "field",
                                  "record": {
                                    "kind": "variable",
                                    "name": "r"
                                  }
                                },
                                "right": {
                                  "kind": "variable",
                                  "name": "material"
                                }
                              }
                            ]
                          },
                          "sort": []
                        },
                        "kind": "count"
                      },
                      "right": {
                        "kind": "literal",
                        "value": {
                          "kind": "integer",
                          "value": 0
                        },
                        "value_type": {
                          "kind": "integer"
                        }
                      }
                    }
                  ]
                },
                "sort": []
              },
              "kind": "for_each",
              "steps": [
                {
                  "bind": "made_link",
                  "entity": "requirement",
                  "kind": "create",
                  "values": {
                    "job": {
                      "kind": "variable",
                      "name": "owner"
                    },
                    "material": {
                      "kind": "variable",
                      "name": "material"
                    },
                    "required": {
                      "kind": "literal",
                      "value": {
                        "kind": "boolean",
                        "value": true
                      },